Ouaninou,Koonan,6553,11,71.3,58.8,16.1,RDR,58.8,170,64.1,46.4,NA,Independen,53.6,NA,NA,NA,Maou,0,0,no,yes,no,yes,no,no,2,yes,2002,Camp militaire,Sylla - Allekele - Amed Billy - Vieux Ba (commandante de poste),no,yes,Maou,Militaires,moins de cinquante,yes,Nord,"dozos, forces impartiales",no,n/a,n/a,n/a,yes,le comportement des FN,entre cinquante et cent,yes,FN,yes,yes,"mediation, public services",chefs traditionnels,no,n/a,yes,"enseignants, autres fonctionnaires",FN,"FN, chefs traditionnels",FN,"enseignants professionnels, enseignants volontaires",0,"personnels de sante professionnel, acteurs internationaux",0,personne,personne,yes,"directedment des commercants, laisser-passer, barrages routiers, licences pour les taxis, imports au march√©",frequemment,mauvais comportement de certains elements des Forces Nouvelles,no,n/a,no,n/a,no,n/a,no,n/a,0,no,n/a,no,n/a,0,no,n/a,no,0,no,no,no,no,0,chef du village,Islam,missing,pas d'enseignement formel acheve,quelques difficultes,partiellement sincere,connaissance moyenne,4,0,0,0,1,0,1,1,4,1,1,1,0,0,0,0,52.6,8.787678239,56.2,2,0,8.787678239,0,Koonan,0,0,0,NA,NA,1.268575525,0.4,0,0.1,0.2,0,0.2,3.4
Ouaninou,Ouaninou,20790,11,71.3,58.8,16.1,RDR,58.8,170,64.1,46.4,NA,Independen,53.6,NA,NA,NA,Maou,0,0,yes,yes,no,yes,yes,no,4,yes,2002,Camp militaire,"Tiken, Mamadou Sylla, Doumbia Siaka (commandants de secteur)",no,yes,Maou,"Militaires, civiles",plus de deux-cent,no,Nord,"dozos, forces impartiales, autre (liberien)",no,n/a,n/a,n/a,yes,le comportement des FN,plus de cent,yes,FN,yes,yes,"mediation, public services, soutien a l'agenda politique ","chefs traditionnels, politiciens locaux",yes,chefs traditionnels,yes,"chefs traditionnels, politiciens locaux, commercants, enseignants, personnel de sante, autres fonctionnaires","FN, chefs traditionnels",chefs traditionnels,"FN, forces impartiales","chefs traditionnels, enseignants professionnels, enseignants volontaires, acteurs internationaux",0,", acteurs internationaux",0,FN,personne,yes,"directedment des commercants, laisser-passer, barrages routiers, licences pour les taxis, imports au march√©",occasionellement,mauvais comportement de certains elements des Forces Nouvelles,yes,"maintenir l'ordre, resoudre les problemes de terre et les disputes sur des affaires de propriete",yes,"barrages routiers, directement des commercants",yes,"maintenir l'ordre, resoudre les problemes de terre et les disputes sur des affaires de propriete",yes,barrages routiers,1,"oui, moins frequemment que chaque mois mais plus que deux fois par an",visite de nature privee,"oui, moins frequemment que chaque mois mais plus que deux fois par an",visite de nature privee,1,no,n/a,no,0,no,no,no,no,0,chef du village,missing,Maou,pas d'enseignement formel acheve,pas de difficultes,tres sincere,bonne connaissance,6,1,0,0,1,1,1,1,3,1,1,1,1,0,1,2,52.6,9.942227381,56.2,3,0,9.942227381,2,Ouaninou,0,0,0.027777778,0.225,2.358974359,1.180070475,0.4,0,0.1,0.2,0,0.2,3.4
Katiola,Fronan,38917,96,44.5,44.9,55.1,PDCI,55.1,161,43.8,42.5,47.1,PDCI,47.1,28895,47970,0.602356,Senoufo,0,1,no,yes,yes,yes,missing,missing,3,no,2002,Camp militaire,don't know,don't know,yes,"Senoufo (Tagbana), etrangers",Militaires,moins de cinquante,yes,don't know,"dozos, forces impartiales",no,n/a,n/a,n/a,yes,Manifest√©s de population,don't know,yes,FN,no,yes,mediation,"chefs traditionnels (chef de canton), ",yes,"chefs traditionnels (towards end of rebellion, chef did not appreciate comportement of rebels, used occult power to cause an accident and kill some of them)",yes,enseignants,FN,"FN, chefs traditionnels",FN,"enseignants volontaires, parents",0,personnels de sant√© professionels,0,personne,personne,yes,"laisser-passer, barrages routiers, impots au marche",occasionellement,mauvais comportement de FN,no,n/a,no,n/a,no,n/a,no,n/a,0,yes,Visite chez des membres des √©lites communautaires,yes,Visite chez des membres des √©lites communautaires,1,don't know,n/a,yes,0,no,no,no,leader communautaier,1,fonctionnaire du mairie,Catholique,Tagbana,Baccalaureat +2,Pas de difficultes,Partiellement sincere,Connaissance moyenne,5,1,1,0,1,2,0,1,3,1,1,1,0,0,0,2,43.7,10.56918645,51.1,2,0,10.56918645,0,Fronan,0,0,0.028571429,NA,NA,0.72584222,0.45,0.45,0.65,0.05,0.05,0.1,1.7
Mankono,TiÈningbouÈ,41218,23,55.6,30.6,9.72,RDR,30.6,178,52.6,60.5,39.5,RDR,60.5,38704,47697,0.811456,Malink√© (Koro),0,1,no,yes,yes,yes,yes,yes,5,yes,2002,Barrage,Bamba CB,no,yes,Malink√© (Koro),Militaires,moins de cinquante,no,"bouake, district des savanes, dinguele, burkina, mali","dozos, forces impartiales",no,n/a,n/a,n/a,yes,fausses accusations,moins de vingt,yes,FN,yes,no,n/a,n/a,no,n/a,yes,"politiciens locaux, enseignants, personnels de sant√©","FN, dozos",FN,"FN, dozos","enseignants volontaires, ONG locale, acteurs internationaux",0,personnels de sant√© volontaires,0,personne,personne,yes,"directement des commercants, laisser-passer, barrages routiers",frequemment,"question de terre (propri√©t√©), mauvais comportement de certains elements des FN",no,n/a,yes,barrages routiers,no,n/a,no,n/a,1,oui (il a reside ici),Il reside ici,yes,r√©side ici,1,no,n/a,no,0,missing,no,no,no,1,agriculteur,musulman,koro,CEPE,ND,ND,ND,7,1,0,0,1,2,1,0,4,1,1,1,0,0,0,2,45.55,10.62663033,45.55,2,0,10.62663033,0,TiÈningbouÈ,0,0,0.685714286,0.375,2.461538462,NA,0.45,0.5,0.5,0.05,0,0,1.45
Kani,Kani,31211,201,75.4,79.4,14.1,RDR,79.1,180,66.6,59.7,NA,RDR,59.7,NA,NA,NA,Malink√©,0,1,yes,yes,yes,yes,yes,no,5,no,2002,Camp militaire,"""Grouman"", Miet√© Abou (""Chef de secteur"")",yes,yes,"Malink√©, Etrangers",Militaires,plus de deux-cent,no,"Nord, CEDEAO","dozos, forces impartiales",no,n/a,n/a,n/a,yes,Mauvais comportement de FN,don't know,yes,"FN, criminels",yes,yes,"mediation, public services","chefs traditionnels, religieux, autres fonctionnaires (maire), dozos",no,n/a,yes,"engseignants, personnel de sante, autres fonctionnaires","FN, dozos, forces impartiales",chefs traditionnels,"FN, dozos, forces impartiales","FN, enseignants professionels, enseignants volontaires, ONG locale, autres personnes puissante dans la communaute",1,"personnels de sant√© professionnels, personnels de sant√© volontaires, acteurs internationaux, politicens locaux",0,personne,personne,yes,"directement des commercants, autres (taxes sur anarchides, through centrale)",jamais,n/a,no,n/a,no,n/a,no,n/a,no,n/a,0,yes,il reside ici,"oui, il reside ici",visite de nature privee (coms-secteur lives here),1,no,n/a,yes,0,no,no,no,Homme/femme d'affaire,0,Maire,Islam,Malink√©,,Pas de difficultes,"Pas du tout sincere (maire), but supplemented by other interviews in another village",Bonne connaissance,7,1,1,0,1,1,1,1,2,1,1,0,0,0,0,1,69.55,10.34852588,69.4,3,0,10.34852588,2,Kani,1,0,0.166666667,0.05,2.090909091,1.20472011,0.3,0.2,0.3,0,0,0,1.9
Niakaramandougo,Niakaramandougo,49824,97,43.4,64.6,35.3,RDR,64.6,163,45.4,43.2,26.1,RDR,43.2,NA,NA,NA,Tagbana,0,1,yes,yes,yes,yes,yes,yes,6,no,2002,Camp militaire,comsecteur (name unknown),no,yes,"Tagbana/Senoufo, Malinke, CEDEAO","Militaires, civiles",plus de deux-cent,no,"Nord, CEDEAO","dozos, forces impartiales",no,n/a,n/a,n/a,yes,"ils cocufiaient les jeunes, filles de la ville; les couvre feux non justifies; les vols par les FN",entre vingt et cinquante,yes,FN,no,no,n/a,n/a,no,n/a,yes,"politiciens locaux, enseignants, personnel de sante","FN, dozos, forces impartiales",FN,"FN, dozos","chefs traditionnels, enseignants volontaires, acteurs internationaux",0,"personnels de sante benevole, FN (sequestre par FN)",1,personne,personne,yes,"directement des commercants, laisser-passer, barrages routiers, impots au march√©",occassionellement,"questions de terre/propriete, mauvais comportement de FN",yes,"maintenir l'ordre, resourdre les problemes de terre et les disputes sur des affaires de propriete",yes,"laisser-passer aux transporteurs, barrages routiers",no,n/a,no,n/a,1,no,n/a,"oui, occasionnellement (une ou deux fois par an)",visite de nature privee,1,no,n/a,yes,0,no,no,no,no,0,chef de canton,catholique,Tagbana,pas d'enseignement formele achev√©,quelques difficultes,tres sincere,bonne connaissance,8,1,0,0,1,1,0,0,2,1,1,0,0,0,1,2,53.9,10.81625207,53.9,3,0,10.81625207,1,Niakaramandougo,0,0,0.5,0.4,1.315789474,1.08023063,0.1,0.4,0.2,0.05,0.1,0.05,2.25
Mankono,Bouandougou,35671,23,55.6,30.6,9.72,RDR,30.6,176,44.9,71.4,NA,RDR,71.4,38704,47697,0.811456,Koro,0,1,no,no,yes,yes,yes,no,3,no,2002,Camp militaire,"fils du chef (chef de poste), Lieutenant Bamba (comsecteur), Capitaine Dembele",missing,yes,"Malink√© (Koro), Senoufo (tagbana)","Militaires, charg√©s de chercher la nourriture",moins de cinquante,yes,"abidjan, bouake, Nord, burkina, mali, liberia ","dozos, forces impartiales",no,n/a,n/a,n/a,no,n/a,n/a,yes,FN,no,yes,mediation,chefs traditionnels,no,n/a,yes,"politiciens locaux, enseignants, chefs traditionnels religieux","FN, dozos",chefs traditionnels,"FN, dozos","chefs traditionnels, enseignants volontaires, acteurs internationaux",0,"personnels de sant√© professionnels, personnels de sant√© volontaires, acteurs internationaux",0,personne,personne,yes,"directement des commercants, laisser-passer, barrages routiers, impots au march√©",jamais,n/a,yes,maintenir l'ordre,no,n/a,no,n/a,no,n/a,0,yes,il reside ici,yes,il reside ici,1,no,n/a,no,1,missing,no,no,no,1,agriculteur,musulman,koro,pas d'enseignement formele achev√©,ND,ND,ND,5,1,0,0,1,3,0,1,1,0,1,0,0,0,1,4,51,10.48209331,51,2,0,10.48209331,0,Bouandougou,0,0,0.5,NA,NA,0.567088545,0.45,0.5,0.5,0.05,0,0,1.45
Koro,Koro,23596,10,52.3,65.2,NA,RDR,65.2,168,59.6,46.2,53.8,Independen,53.8,NA,NA,NA,Yacouba,0,1,yes,yes,yes,yes,yes,no,5,yes,2002,Camp militaire,Abou-Soumahoro Zoumana (commandant de secteur),no,no,n/a,n/a,n/a,yes,Nord,"dozos, forces impartiales",no,n/a,n/a,n/a,yes,le comportement des FN,plus de cent,yes,FN,no,no,n/a,n/a,no,n/a,no,n/a,"FN, dozos","FN, chefs traditionnels","FN, dozos","enseignants professionels, enseignants volontaires, ONG locale, acteurs internationaux",0,"personnels de sante professionnel, personnels de sante volontaires, acteurs internationaux",0,personne,personne,yes,"directement des commercants, laisser-passer, barrages routiers, impots au march√©",frequemment,mauvais comportement de certains elements des Forces Nouvelles,no,n/a,no,n/a,no,n/a,no,n/a,0,"oui, occasionnellement (une ou deux fois par an), Kone Zakaria est venu pour avoir des benedictions",ceremonies de nature privee,no,n/a,1,no,n/a,no,0,no,no,no,no,0,chef du village,Islam,Malink√©,BEPC,quelques difficultes,partiellement sincere,bonne connaissance,7,1,0,0,0,1,0,0,4,1,1,1,0,0,0,1,55.7,10.06883249,59.5,2,0,10.06883249,-1,Koro,0,0,0.25,0.1,1.555555556,1.445425196,0.3,0.2,0.1,0.1,0,0.1,3
Koro,Niokosso,6308,9,73,60.5,NA,RDR,60.5,168,59.6,46.2,NA,Independen,53.8,NA,NA,NA,"Dyula (Beka, Finaga)",0,0,no,no,yes,yes,no,no,2,missing,2003,Camp militaire,Malokoa - chef de poste,no,yes,missing,Militaires,moins de cinquante,yes,,aucun,no,n/a,n/a,n/a,yes,"mauvaise comportement, predation",plus de cent,yes,FN,yes,yes,"mediation, public services",chefs traditionnels,no,n/a,yes,"enseignants, personnel de sante, autres fonctionnaires","FN, forces impartiales","FN, chefs traditionnels",FN,"enseignants professionels, enseignants volontaires, ONG locale, acteurs internationaux",0,"FN, acteurs internationaux",1,personne,personne,yes,"directement des commercants, laisser-passer, barrages routiers, impots au march√©",frequemment,"taxation, questions de terre/propriete, mauvaise comportement de certains elements de FN, conflits d'autorite entre leaders des FN",yes,"maintenir l'ordre, resourdre les problemes de terre et les disputes sur des affaires de propriete",yes,barrages routiers,no,n/a,no,n/a,1,no,n/a,no,n/a,0,no,n/a,no,0,no,no,no,no,0,"chef du village, chef de terre, fils de chef",Islam,Malink√©,n/a (focus group),quelques difficultes,tres sincere,bonne connaissance,4,1,0,0,1,0,1,1,4,1,1,1,0,0,1,1,53.35,8.749573948,57.15,3,0,8.749573948,1,Niokosso,0,0,1,NA,NA,1.582129537,0.3,0.2,0.1,0.1,0,0.1,3
Korhogo,Kanoroba,18555,168,73.8,97.3,1.42,RDR,97.3,137,55.4,55.1,44.9,RDR,55.1,126646,161186,0.785713,Senoufo,0,0,no,no,no,yes,yes,no,2,no,2003,Camp militaire,Commandant Konat√© (comsecteur),no,yes,"Senoufo, Malinke",Militaires,entre cinquante et cent,yes,Nord,dozos,no,n/a,n/a,n/a,no,n/a,n/a,no,n/a,yes,yes,"mediation, public services","chefs traditionnels, religieux, leaders d'associations de jeunes, dozos",no,n/a,yes,"enseignants, personnel de sante, autres fonctionnaires","FN, dozos",chefs traditionnels,"FN, dozos","chefs traditionnels, enseignants volontaires, autre (parents d'eleves)",0,"chefs traditionnels, acteurs internationaux",0,personne,personne,yes,"directement des commercants, laisser-passer, barrages routiers, licences pour les taxis, impots au march√©",jamais,n/a,yes,maintenir l'ordre,no,n/a,no,n/a,no,n/a,0,no,n/a,no,n/a,0,no,n/a,no,0,yes,no,no,homme/femme d'affaire,1,chef de canton,Animiste,Senoufo,pas d'enseignement formel acheve,pas de difficultes,tres sincere,bonne connaissance,4,1,1,0,1,1,1,1,0,0,0,0,1,0,1,2,76.2,9.828494573,76.2,2,0,9.828494573,1,Kanoroba,0,0,1,NA,NA,1.399148609,0.1375,0.425,0.1625,0.3625,0.1,0.1625,2.6375
Koro,Booko,18356,9,73,60.5,NA,RDR,60.5,166,60.3,36.7,NA,Independen,39.6,NA,NA,NA,Barala,0,0,no,yes,yes,yes,yes,no,4,yes,2002,Camp militaire,"Traore, Bagate (comsecteur)",no,yes,,Militaires,don't know,yes,Nord,"dozos, forces impartiales",no,n/a,n/a,n/a,no,n/a,n/a,yes,FN,yes,yes,mediation,chefs traditionnels,no,n/a,yes,"religieux, enseignants, personnel de sante, autres fonctionnaires",FN,"FN, chefs traditionnels",FN,enseignants volontaires,0,"personnels de sante benevole, acteurs internationaux",0,FN,personne,yes,"directement des commercants, laisser-passer, barrages routiers, licences pour les taxis, impots au marche",occasionellement,mauvais comportement de certains elements des Forces Nouvelles,yes,maintenir l'ordre,no,n/a,no,n/a,no,n/a,0,yes,ceremonies de nature privee,yes,ceremonies de nature privee,1,no,n/a,yes,0,yes,no,yes,no,1,chef du village,Islam,Barala,BEPC,pas de difficultes,tres sincere,bonne connaissance,6,1,0,0,1,2,1,1,2,0,1,1,0,0,1,3,48.6,9.817711776,50.05,3,0,9.817711776,2,Booko,0,0,0.861111111,0.8,1.684210526,1.780181717,0.3,0.2,0.1,0.1,0,0.1,3
Koro,Borotou,5353,9,73,60.5,NA,RDR,60.5,167,77.1,49.3,NA,Independen,50.7,NA,NA,NA,Malink√©,0,1,no,yes,yes,yes,no,no,3,yes,2002,Camp militaire,Soumahoro - Dosso Aboulaye - Doumbia Souleymane - Coulibaly (commandant de secteur),no,yes,Malink√©,"Militaires, civiles",entre cinquante et cent,no,Nord,"dozos, forces impartiales",no,n/a,n/a,n/a,yes,le comportement des FN,plus de cent,yes,FN,yes,no,n/a,n/a,no,n/a,yes,"enseignants, personnel de sante, autres fonctionnaires","FN, dozos, forces impartiales",chefs traditionnels,"FN, dozos","FN, enseignants professionnels, enseignants volontaires, acteurs internationaux",1,"personnels de sante benevole, acteurs internationaux",0,personne,personne,yes,"barrages routiers, licences pour les taxis",occasionellement,mauvais comportement de certains elements des Forces Nouvelles,no,n/a,no,n/a,no,n/a,no,n/a,0,"oui, occasionnellement (une ou deux fois par an)",ceremonies de nature privee,"oui, occasionnellement (une ou deux fois par an)",ceremonies de nature privee,1,no,n/a,missing,0,no,no,no,leader communautaire,0,chef du village,Islam,missing,Baccalaureat,pas de difficultes,tres sincere,bonne connaissance,5,1,1,0,1,1,1,0,3,1,1,1,0,0,0,1,54.9,8.58541243,55.6,3,0,8.58541243,2,Borotou,0,0,NA,NA,NA,1.699453176,0.3,0.2,0.1,0.1,0,0.1,3
Korhogo,KiÈmou,22422,169,59.3,25.6,42.1,PDCI,42.1,136,38.1,89.5,NA,RDR,89.5,126646,161186,0.785713,Senoufo,0,0,no,no,no,yes,yes,no,2,yes,2002,Camp militaire,Chef de poste at Napie,no,yes,Senoufo,Militaires,moins de cinquante,yes,"Nord, pays limitrophes",forces impartiales,no,n/a,n/a,n/a,yes,"pillage, forced taxation",moins de vingt,yes,FN,no,yes,mediation,chefs traditionnels,no,n/a,yes,"enseignants, commercants, personnel de sante, autres fonctionnaires","dozos, forces impartiales","FN, chefs traditionnels","dozos, forces impartiales","enseignants professionnels, enseignants volontaires, autre (auto-finance, villagers)",0,medecins,0,personne,personne,yes,"laisser-passer, barrages routiers, impots au marche",occasionellement,"taxation, questions de terre/propriete, mauvais comportement de certains elements des FN",yes,maintenir l'ordre,don't know,n/a,no,n/a,don't know,n/a,0,no,n/a,no,n/a,0,no,n/a,yes,0,no,no,no,no,0,cheferie,Islam,Senoufo,CEPE,pas de difficultes,tres sincere,bonne connaissance,4,0,1,0,1,0,0,1,3,1,1,1,0,0,1,1,57.55,10.0177979,65.8,0,0,10.0177979,0,KiÈmou,0,0,0.833333333,NA,NA,NA,0.1375,0.425,0.1625,0.3625,0.1,0.1625,2.6375
Dabakala,Foumbolo,18808,95,65.2,64.1,5.01,RDR,64.4,158,61.5,35.2,NA,RDR,35.2,26804,33857,0.791683,Senoufo,0,0,no,yes,no,yes,no,no,2,missing,2002,Camp militaire,"Moussa, Doumbia",missing,yes,Senoufo (djimini),Militaires,moins de cinquante,no,"burkina faso, mali","dozos, forces impartiales",no,n/a,n/a,n/a,yes,racket,moins de vingt,no,n/a,yes,yes,mediation,chefs traditionnels,no,n/a,yes,enseignants et autres fonctionnaires,FN,chefs traditionnels,FN,"enseignants professionnels, enseignants volontaires, ONG locale",0,personnels de sant√© professionnels,0,personne,chefs traditionnels,no,n/a,occasionellement,mauvais comportement de certains element des FN,no,n/a,no,n/a,no,n/a,no,n/a,0,yes ,il est originaire de la ville,yes,il est originaire de la ville,1,no,n/a,no,0,missing,no,no,agent de mairie,0,chef du village,Islam,djimini,pas d'enseignement formel achev√©,quelques difficult√©s dans la comprehension,partiellement sinc√®re,connaissance moyenne,4,1,1,0,1,1,1,1,2,1,0,1,0,0,0,1,49.65,9.84203759,49.8,2,0,9.84203759,1,Foumbolo,0,0,0,0.894736842,1,0.704196819,0.55,0.5,0.5,0.15,0.1,0.05,1.3
Odienn√©,Bako,17253,121,74.8,71.8,1.27,RDR,71.8,44,68.2,69.6,NA,RDR,69.6,43565,48431,0.899527,Malink√©,0,1,no,yes,yes,yes,yes,no,4,yes,2002,Camp militaire,Kone N'Golo - Kone Bakari - Silla (Commandant de secteur),no,yes,Malink√©,Militaires,entre cent et deux-cent,no,Nord,"dozos, forces impartiales",no,n/a,n/a,n/a,yes,le comportement des FN,entre cinquante et cent,yes,FN,no,no,n/a,n/a,no,n/a,yes,"enseignants, personnel de sante, autres fonctionnaires",FN,FN,FN,"enseignants professionnels, enseignants volontaires, acteurs internationaux",0,personnels de sante volontaires,0,personne,personne,yes,"directement des commer√ßants, laisser-passer, barrages routiers, licences pour les taxis, impots au march√©","non, jamais",n/a,no,n/a,no,n/a,no,n/a,no,n/a,0,"oui, moins frequemment que chaque mois mais plus que deux fois par an",ceremonies de nature privee,"oui, moins frequemment que chaque mois mais plus que deux fois par an",ceremonies de nature privee,1,no,n/a,no,0,no,no,no,no,0,agriculteur,Islam,missing,CEPE,pas de difficultes,tres sincere,bonne connaissance,6,1,1,0,1,1,0,0,2,1,1,0,0,0,0,1,70.7,9.75574132,70.7,2,0,9.75574132,0,Bako,0,0,0.88,0,NA,1.961964173,0.2,0.5,0.1,0.5,0,0.3,2.7
Boundiali,Boundiali,59586,15,56.9,60.4,15.5,RDR,60.4,123,53.4,13,NA,Independen,32.2,42838,56221,0.761957,Senoufo,0,1,yes,yes,yes,yes,yes,yes,6,yes,2002,Camp militaire,"Toure, Gaoussou Kone (Jah Gao) (commandant de sectur/zone)",no,yes,"Senoufo, Malinke",Militaires,don't know,no,Nord,dozos,no,n/a,n/a,n/a,yes,le comportement des elements,don't know,yes,FN,yes,yes,"mediation, public services",chefs traditionnels,no,n/a,yes,"enseignants, personnel de sante, autres fonctionnaires","FN, dozos","FN, chefs traditionnels",dozos,"enseignants professionnels, enseignants volontaires, ONG locale",0,"personnels de sante professionnel, acteurs internationaux",0,personne,personne,yes,"directement des commercants, barrages routiers, licences pour les taxis, impots au marche",occasionellement,mauvais comportement de certains elements des Forces Nouvelles,no,n/a,no,n/a,no,n/a,no,n/a,0,"oui, moins frequemment que chaque mois mais plus que deux fois par an",visite chez des membres des elites communautaires,"oui, moins frequemment que chaque mois mais plus que deux fois par an",visite chez des membres des elites communautaires,1,yes,dons/offres a des particuliers ,no,1,no,no,no,no,0,chef du village,Islam,missing,pas d'enseignement formel acheve,pas de difficultes,tres sincere,bonne connaissance,8,1,1,0,1,2,1,1,3,1,1,1,1,0,0,2,36.7,10.99517593,46.3,1,0,10.99517593,1,Boundiali,0,1,0.835443038,0.355932203,1.830188679,2.024580947,0.2,0.45,0.2,0.3,0.2,0.2,2.45
Korhogo,Komborodougou,12947,167,62.9,62.7,15.5,RDR,62.7,133,61.8,33.4,16.8,Independen,49.8,126646,161186,0.785713,Senoufo,0,0,no,yes,no,yes,no,no,2,yes,2002,Camp militaire,"Kassoum (""commandant de secteur"")",no,yes,Senoufo,Militaires,moins de cinquante,yes,Nord,dozos,no,n/a,n/a,n/a,no,n/a,n/a,yes,FN,yes,yes,public services,chefs traditionnels,no,n/a,yes,"politiciens locaux, enseignants, autres fonctionnaires",FN,FN,FN,"enseignants professionnels, enseignants volontaires",0,"personnels de sant√© professionels, autre (communaute catholique)",0,personne,personne,yes,"laisser-passer, barrages routiers, impots au marche",frequemment,"taxation, mauvais comportement de FN",no,n/a,yes,barrages routiers,no,n/a,no,n/a,1,no,n/a,no,n/a,0,no,no,no,0,no,no,no,no,0,agriculteur,aucune,Senoufo,CEPE,quelques difficult√©s,partiellement sincere,bonne connaissance,4,1,1,0,1,0,1,1,3,0,1,1,0,0,0,0,48.05,9.46861938,56.25,2,0,9.46861938,1,Komborodougou,0,0,0.923076923,0.894736842,1.5625,1.402486459,0.1375,0.425,0.1625,0.3625,0.1,0.1625,2.6375
Korhogo,Sirasso,28160,168,73.8,97.3,1.42,RDR,97.3,137,55.4,55.1,44.9,RDR,55.1,126646,161186,0.785713,Senoufo,0,0,no,yes,yes,yes,yes,no,4,yes,2002,Camp militaire,don't know,no,yes,"Senoufo, melage",Militaires,don't know,yes,don't know,"dozos, forces impartiales",no,n/a,n/a,n/a,no,n/a,n/a,no,n/a,yes,yes,"mediation, political support",chefs traditionnels,no,n/a,yes,"enseignants, autres fonctionnaires","FN, chefs traditionnels, dozos",chefs traditionnels,"FN, dozos, forces impartiales","chefs traditionnels, enseignants volontaires, autre (parents de village)",0,"personnels de sant√© professionels, autre (communaute catholique)",0,personne,personne,yes,"laisser-passer, barrages routiers","non, jamais",n/a,no,n/a,no,n/a,no,n/a,no,n/a,0,"oui, il reside/a reside ici","ceremonies de nature privee, visite chez des membres des elites communautaires, visite de nature privee","oui, il reside/a reside ici","ceremonies de nature privee, visite chez des membres des elites communautaires, visite de nature privee",1,yes,"dons/offres a la communaute, dons/offres a des particuliers, dons/offres aux anciens elements des FN",yes,1,yes,no,no,dirigeant de la branche locale d'un partie politique,1,chef du village,aucune,Senoufo,pas d'enseignement acheve,quelques difficult√©s,tres sincere,connaissance moyenne,6,1,1,0,1,3,1,1,0,0,0,0,0,1,0,3,76.2,10.24565781,76.2,2,0,10.24565781,1,Sirasso,0,0,1,0.65,2.473684211,1.61075978,0.1375,0.425,0.1625,0.3625,0.1,0.1625,2.6375
Dikodougou,Dikodougou,39567,163,55.3,73.5,NA,RDR,73.5,130,50.3,19,NA,Independen,52.3,NA,NA,NA,Senoufo,0,0,yes,yes,yes,yes,yes,no,5,yes,2002,Camp militaire,Commandant Idjao (comsecteur),no,yes,"Senoufo, Malinke",Militaires,moins de cinquante,yes,autre (Sudiste),"dozos, forces impartiales",no,no,n/a,n/a,no,n/a,n/a,yes,FN,missing,yes,"mediation, public services","chefs traditionnels, dozos",no,n/a,yes,"religieux, autres fonctionnaires, enseignants, autres (etrangers)","FN, dozos, forces impartiales","FN, chefs traditionnels","FN, dozos","enseignants volontaires, autre (la COGES)",0,"personnels de sante professionel, autre (fils du village)",0,personne,personne,yes,"directement des commer√ßants, laisser-passer, licences pour les taxis, impots au march√©",occasionellement,taxation,yes,"maintenir l'ordre, proteger des ataques d'autres groups armes",yes,"directement des commercants, emission de laisser-passer, barrages routiers, imports au marche",no,n/a,no,n/a,1,no,n/a,no,n/a,0,no,n/a,no,0,no,no,no,no,0,chef de canton,catholique,Senoufo,BEPC,pas de difficultes,partiellement sincere,bonne connaissance,7,1,1,0,1,0,0,1,2,0,1,1,0,0,1,1,46.25,10.58575072,62.9,2,0,10.58575072,0,Dikodougou,0,0,1,0.55,1.222222222,1.326512348,NA,NA,NA,NA,NA,NA,NA
