Bouak√©,BouakÈ Centre,NA,60,42.2,63.4,29.3,RDR,63.4,151,43.5,16.6,22.3,Independen,49.8,83059,170567,0.486958,Malink√©,0,1,yes,yes,yes,yes,yes,yes,6,yes,2002,Camp militaire,Konate Daouda,no,yes,"Malinke, Yacouba",Militaires ,entre cinquante et cent,no,"Abidjan, ne sait pas",none,yes,"FN-FDS, FN-FN","2002, 2005",don't know,no,n/a,n/a,no,n/a,missing,yes,"mediation, public services, political support","religieux, commercants, enseignants, leaders de societe civile, leaders d'associations de jeunes",no,n/a,yes,"chefs traditionnels, politiciens locaux, enseignants",FN ,personne,FN ,"FN, enseignants volontaires, ONG locale, autres personnes puissantes dans la communaute, acteurs internationaux",1,"FN, personnels de sant√© professionels, acteurs internationaux",1,personne,personne,yes,"directement des commer√ßants, barrages routiers, impots au march√©",jamais,n/a,no,n/a,no,n/a,no,n/a,no,n/a,0,yes,"visite privee, visite militaire",yes,"visite privee, visite militaire",1,yes,"argent de poche, nourriture, riz, sucre",missing,1,yes,no,no,no,1,fonctionnaire de l'administration locale,Islam,Malinke,Enseignement secondaire acheve (technique),Quelques difficult√©s dans la comprehension,Tr√®s sincere,connaissance moyenne,8,1,1,1,1,3,0,1,0,0,0,0,1,1,0,3,40,NA,56.6,4,0,13.19224199,1,BouakÈ,0,1,NA,NA,NA,NA,0.466666667,0.588888889,0.377777778,0.122222222,0.077777778,0.288888889,1.322222222
Biankouma,Blapleu,14750,190,50.8,NA,NA,UDPCI,66.9,102,54.9,31.8,NA,UDPCI,68.2,3526,31964,0.110312,Yacouba,0,0,no,no,no,yes,yes,no,2,no,2002,Camp militaire,"""Bava""",no,no,n/a,n/a,n/a,yes,"Nord, CEDEAO","milices locales, dozos, forces impartiales",no,n/a,n/a,n/a,yes,"Pillages, Mauvais comportement des elements FN",entre vingt et cinquante,yes,"FN, Autres groupes arm√©",don't know,no,n/a,n/a,no,n/a,yes,"chefs traditionnels, religiuex, politiciens locaux, commercants, enseignants, personnel de sante, autres fonctionnaires",personne,personne,personne,enseignants volontaires,0,personnels de sant√© volontaires,0,personne,personne,yes,"directement des commercants, laisser-passer, barrages routiers, impots au march√©, autre (force)",frequemment,"taxation, mauvais comportement des elements FN",no,n/a,yes,barrages routiers,no,n/a,no,n/a,1,no,n/a,no,n/a,0,no,n/a,no,0,no,no,no,no,0,Fonctionnaire √† la retraite,Islam,Yacouba,BEPC,Beaucoup de difficult√©s dans la compr√©hension,Partiallement sinc√®re,Connaissance moyenne,4,1,0,0,0,0,0,0,4,1,1,1,0,0,0,0,NA,9.598998362,67.55,0,0,9.598998362,-1,Blapleu,0,0,0,NA,NA,0.50994922,0.45,0.25,0.4,0.35,0.05,0.3,1.95
Man,GbangbÈgouinÈ-Y,10068,196,41.5,14.2,10.8,Independent,51.3,108,60.1,48.8,NA,RDR,48.8,20891,88288,0.236623,Yacouba,0,1,no,no,no,yes,no,no,1,no,2002,Barrage,"""gin sal""",no,yes,"Yacouba, CEDEAO",Militaires,entre cinquante et cent,yes,"Nord, Liberia",forces impartiales,yes,FN-FDS,2002,don't know,yes,"viol, pillage",entre cinquant et cent,yes,"FN, mercenaires liberiens",no,yes,"mediation, public services","chefs traditionnels, leaders de la soci√©te civile",no,n/a,yes,"chefs traditionnels, religieux, politiciens locaux, commercants, enseignants, personnel de sante, autres fonctionnaires",FN,FN,"FN, forces impartiales","enseignants volontaires, acteurs internationnaux",0,"personnels de sant√© volontaires, ONG locale, acteurs internationaux",0,personne,personne,yes,"directement des commercants, laisser-passer, barrages routiers, impots au march√©, autre (force)",frequemment,mauvis comportement de certains elements de la FN,no,n/a,no,n/a,no,n/a,no,no,0,no,n/a,no,n/a,0,no,n/a,no,0,no,no,no,no,0,cultivateur,aucune,yacouba,CEPE,pas de difficult√©,sinc√®re,bonne connaissance,3,0,0,1,1,0,0,1,4,1,1,1,0,0,0,0,31.5,9.217117356,50.05,2,0,9.217117356,-1,GbangbÈgouinÈ-Y,0,0,0.230769231,NA,NA,NA,0.44,0.36,0.4,0.1,0.06,0.32,2.02
Man,SangouinÈ,36832,196,41.5,14.2,10.8,Independent,51.3,108,60.1,48.8,NA,RDR,48.8,20891,88288,0.236623,Yacouba,0,1,no,yes,yes,yes,yes,no,4,yes,2002,Camp militaire,"Lan Andre (MPIGO), Kassero Lamin (MPCI then FAFN comsecteur)",no,yes,"Yacouba, Dioula",Militaires,plus de deux-cent,yes,"Nord, Liberia","milices locales, dozos, forces impartiales",yes,FN-FDS,2003,plus de cent,yes,"collateral damage, mauvaise comportement de Liberiens",plus de cent,yes,"FN, Liberian mercenaries",yes,yes,"mediation, public services","chefs traditionnels, religieux, leaders de la soci√©t√© civile, leaders d'associations de jeunes, autres fonctionnaires (adjoint au maire)",yes,chefs traditionnels,yes,"chefs traditionnels, religieux, politiciens locaux, commercants, enseignants, personnel de sante, autres fonctionnaires, leaders de la societe civile","FN, forces impartiales",FN,"FN, forces impartiales","enseignants volontaires, acteurs internationaux, autre (mairie)",0,"personnels de sant√© volontaires, acteurs internationaux",0,personne,personne,yes,"directement des commercants, laisser-passer, barrages routiers, licences pour les taxis, impots au march√©",frequemment,"mauvais comportement de FN, conflits d'autorite entre leaders des FN et d'autres personnes importants dans la communaute",no,n/a,no,n/a,no,n/a,no,n/a,0,"Oui, moins fr√©quemment que chaque mois mais plus que deux fois par an","C√©r√©monies de nature priv√©e, Visite chez des membres des √©lites communautaires, Visite de nature priv√©e","Oui, moins fr√©quemment que chaque mois mais plus que deux fois par an","C√©r√©monies de nature priv√©e, Visite chez des membres des √©lites communautaires, Visite de nature priv√©e",1,yes,Dons/offres √† la communaut√©,yes,1,no,yes,don't know,Fonctionnaire de la mairie,1,Maire,Catholique,Yacouba,Universit√© achev√©e,Pas des difficult√©s,Partiellement sinc√®re,Bonne connaissance,6,1,0,1,1,3,1,1,4,1,1,1,1,0,0,3,31.5,10.51412231,50.05,2,0,10.51412231,0,SangouinÈ,0,0,0.043478261,0.5,4.263157895,NA,0.44,0.36,0.4,0.1,0.06,0.32,2.02
B√©oumi,BÈoumi,73475,56,49.2,17.8,25.5,Independent,56.9,147,48.1,NA,19.7,Independen,32.8,4006,30874,0.129753,Baoul√©,0,1,yes,yes,no,yes,no,no,2,no,2002,Camp militaire,"CO Bamba Moustafa, Garamote",yes,yes,Malink√©,"Militaires, Mecaniciens",entre cent et deux-cent,yes,"Bouak√©, Korhogo, Burkina Faso, Mali, Seguela, Boundiali",dozo,no,n/a,n/a,n/a,yes,"False accusations, theft, poor leadership, problemes d'eleveurs",entre cinquant et cent,missing,missing,missing,yes,missing,"chefs traditionnels, religieux, leaders de la soci√©t√© civile, leaders d'associations de jeunes, dozos",no,n/a,yes,"religieux, politiciens locaux, commercants, enseignants","FN, forces impartiales","FN, chefs traditionnels","FN, forces impartiales","enseignants volontaires, FN, ONG locale (Ecole pour Tous)",1,"personnels de sant√© professionels, FN, ONG locales, autre (Forces Francaises, Etat ivoirien)",1,personne,autre personnes puissante dans la communaut√© (commercants priv√©s),yes,"directement des commercants, laisser-passer, barrages routiers, licences pour les taxis, impots au march√©",occasionellement,"Questions de terre/propriete, mauvaise comportement des elements FN, autre",yes,maintenir l'ordre,no,n/a,yes,maintenir l'ordre,no,n/a,0,missing,missing,missing,missing,1,no,n/a,missing,0,no,no,no,Controler,1,Fonctionnaire √† la retraite,Catholique,Baoul√©,BEPC,Pas des difficult√©s,Tr√®s sincere,,4,1,0,0,1,2,0,1,2,1,0,1,0,0,1,3,NA,11.20470049,44.85,4,0,11.20470049,1,BÈoumi,1,0,0.22,0.316666667,4.914893617,NA,0.733333333,0.533333333,0.6,0.133333333,0,0.033333333,1.4
Danan√©,Daleu,34308,193,45.4,26.2,3.97,UDPCI,34.6,105,51.7,42,12.2,RDR,42,7673,55982,0.137062,Yacouba,0,0,no,no,yes,yes,yes,no,3,yes,2002,Camp militaire,"Capitaine Eddy Meddi (""commandant de secteur"")",no,yes,"Yacouba, Malink√©",don't know,moins de cinquante,no,Nord,"dozos, forces impartiales",no,n/a,n/a,n/a,yes,"reglement de  litiges, pillages, vol des FN",plus de cent,yes,FN,no,yes,"mediation, public services, political support",autre (fonctionnaires),no,n/a,yes,"politiciens locaux, enseignants, personnel sant√©, autres fonctionnaires",FN,FN,personne,"enseignants professionnels, enseignants volontaires",0,acteurs internationaux,0,personne,personne,no,n/a,jamais,n/a,no,n/a,yes,barrages routiers,no,n/a,no,n/a,1,no,n/a,"oui, il vient moins frequemment que chaque mois mais plus que deux fois par an",visite de nature priv√©e,1,don't know,n/a,yes,0,no,no,no,no,0,enseignant,catholique,Yacouba,CEPE,pas de difficult√©s,partiellement sinc√®re,Bonne connaissance,5,1,0,0,1,1,0,1,2,1,1,0,1,1,0,1,34.1,10.44313384,38.3,1,0,10.44313384,0,Daleu,0,0,0,NA,NA,0.45680096,0.625,0.325,0.475,0.125,0.125,0.275,1.175
Sipilou,Sipilou,22417,192,74.7,7.93,NA,Independent,38.3,104,66.3,43.1,NA,RDR,43.1,NA,NA,NA,Yacouba,1,0,yes,yes,yes,yes,yes,no,5,yes,2002,Camp militaire,"Zoom, Zoulou, Soro Siaka (comsecteur)",no,yes,"Yacouba, Melage",Militaires,plus de deux-cent,no,Nord,"milices locales, forces impartiales",no,n/a,n/a,n/a,yes,"mauvaise comportement, taxation",plus de cent,yes,"FN, autres groups arme organise (Liberiens)",yes,yes,"mediation, public services",chefs traditionnels,no,n/a,yes,"enseignants, personnel de sante, autres fonctionnaires, autres (douanes)",FN,chefs traditionnels,FN,"enseignants volontaires, acteurs internationaux",0,"personnels de sante benevole, acteurs internationaux",0,FN,personne,yes,"directement des commercants, laisser-passer, barrages routiers, licences pour les taxis, impots au marche",occasionellement,"taxation, questions de terre, mauvaise comportement",yes,maintenir l'ordre,no,n/a,no,n/a,no,n/a,0,yes,"ceremonies de nature religieuse ou nationale, ceremonies publiques de nature politique, ceremonies de nature privee, visite chez des membres des elites communautaires, visite de nature privee",yes,"ceremonies de nature religieuse ou nationale, ceremonies publiques de nature politique, ceremonies de nature privee, visite chez des membres des elites communautaires, visite de nature privee",1,yes,"dons/offres a la communaute, dons/offres a des particuliers",yes,1,no,no,no,2 elements at mairie,1,"chef de canton, chef de village",Islam,Yacouba,Baccalaureat,pas de difficultes,partiellement sincere,bonne connaissance,7,1,0,0,1,3,1,1,3,1,1,1,0,0,1,4,25.515,10.01757488,40.7,3,1,10.01757488,2,Sipilou,0,0,0.076923077,NA,NA,0.798695493,0.1,0.2,0,0,0.1,0.3,2.6
Sipilou,Yorodougou,19451,192,74.7,7.93,NA,Independent,38.3,104,66.3,43.1,NA,RDR,43.1,NA,NA,NA,Yacouba,1,0,no,no,yes,yes,no,no,2,yes,2003,Barrage,"Zoom, Zoulou, Soro Siaka (comsecteur)",no,yes,"Yacouba, Lobi, Melange",Militaires,moins de cinquante,no,Nord,autres (liberiens),yes,"Liberiens, FN",2007,don't know,no,n/a,n/a,yes,autres groups arme organise (Liberiens),yes,no,"mediation, public services",chefs traditionnels,no,n/a,yes,"religieux, politiciens locaux, commercants, enseignants, personnel de sante, autres fonctionnaires","FN, chefs traditionnels","FN, chefs traditionnels",FN,"enseignants professionnels, enseignants volontaires",0,"personnels de sante professionnel, personnels de sante benevole",0,FN,personne,yes,impots sur les places au marche,occasionellement,mauvais comportement de certains elements des FN,no,n/a,no,n/a,no,n/a,no,n/a,0,yes,"visite de nature militaire, ceremonies publique de nature religieuse ou nationale, visite chez des membres des elites communautaires",yes,"visite de nature militaire, ceremonies publique de nature religieuse ou nationale, visite chez des membres des elites communautaires",1,no,n/a,yes,0,no,no,no,autre (agent de mairie a Sipilou),1,cheferie,autre (animiste),Yacouba,n/a,quelques difficultes,tres sincere,bonne connaissance,4,1,0,1,1,2,1,0,2,0,1,1,1,0,0,2,25.515,9.875653762,40.7,3,1,9.875653762,2,Yorodougou,0,0,0.545454545,NA,NA,0.786016473,0.1,0.2,0,0,0.1,0.3,2.6
Biankouma,Kpata,6741,190,50.8,NA,NA,UDPCI,66.9,102,54.9,31.8,NA,UDPCI,68.2,3526,31964,0.110312,Toula,0,0,no,no,no,yes,yes,no,2,no,2002,Barrage,same as Biankouma,no,no,n/a,n/a,n/a,yes,"Nord, CEDEAO, Liberia","dozo, forces impartiales",yes,FN-population,"2002, 2003",don't know,yes,"mauvaise comportement, vol, taxation",plus de cent,yes,FN,no,yes,mediation,chefs traditionnels,no,n/a,yes,"politiciens locaux, commercants, enseignants, personnel de dante, autres fonctionnaires, leaders de la societe civile",autre (jeunes),chefs traditionnels,autre (jeunes),"enseignants volontaires, acteurs internationaux, parents",0,"personnels de sant√© volontaires, autres personnes puissantes dans la communaute",0,personne,personne,yes,"directement des commercants, laisser-passer, barrages routiers, impots au march√©",frequemment,"taxation, questions de terre/properiete, mauvais comportement de FN",no,n/a,yes,barrages routiers,no,n/a,no,n/a,1,no,n/a,no,n/a,0,no,n/a,no,0,no,no,don't know,don't know,0,N/A (group interview),Animiste,Toula,N/A (group interview),Quelques difficult√©s ,Tr√®s sinc√®re,Connaissance moyenne,4,1,0,1,0,0,0,1,4,1,1,1,0,0,0,0,NA,8.815963561,67.55,0,0,8.815963561,-1,Kpata,0,0,NA,NA,NA,0.764459219,0.45,0.25,0.4,0.35,0.05,0.3,1.95
Mankono,Mankono,64330,25,57.5,87.1,NA,RDR,87.1,176,44.9,71.4,NA,RDR,71.4,38704,47697,0.811456,Malink√©,0,1,yes,yes,yes,yes,yes,yes,6,yes,2002,Camp militaire,"Dosso n'gobah, siaka ouattara, schikitou, toungara(malien), ouattara zoumana",yes,yes,"Malink√©, burkinabe, senoufo","Militaires, activit√©s politiques",plus de deux-cent,yes,"Nord, district des savanes, burkina faso, mali",missing,no,n/a,n/a,n/a,yes,"viols, vengence, execution sommaire",plus de cent,yes,FN,yes,yes,"mediation, public services, political support","chefs traditionnels, religieux, leaders de la societe civile, leaders d'associations de jeunes",no,n/a,yes,"politiciens locaux, commer√ßants, enseignants, personnel de sant√©, autres fonctionnaires",FN,personne,FN,"FN, enseignants volontaires, ONG locales (Ecole pour Tous)",1,"religieux, personnels de sant√© volontaires, acteurs internationnaux",0,personne,personne,yes,"directement des commercants, laissez passer, impots au march√©",occasionellement,mauvais comportement de certains √©l√©ments de la FN,yes,"secteur educatif, infrastructures",no,n/a,yes,"secteur educatif, infrastructures",no,no,0,yes,"C√©r√©monies publiques de nature religieuse ou nationale, C√©r√©monies de nature priv√©e, Visite chez elites communautaires, visite priv√©e",yes,"C√©r√©monies publiques de nature religieuse ou nationale, C√©r√©monies de nature priv√©e, Visite chez elites communautaires, visite priv√©e",1,yes,"dons a la communaut√©, a des particuliers, aux d√©mobilis√©s",yes,1,yes,no,no,"Leader communautaire, Fonctionnaire, Dirigeant d‚Äôune ONG 
",1,sans emploi,musulman,koyaka,pas d'enseignement formel achev√©e,pas de difficult√© dans le comprehension,tres sinc√®re,bonne connaissance,8,1,1,0,1,3,1,1,3,1,1,1,1,1,1,4,79.25,11.07178136,79.25,3,0,11.07178136,2,Mankono,1,1,0.18,0.320512821,2.457627119,0.579850011,0.45,0.5,0.5,0.05,0,0,1.45
Botro,Diabo,26272,59,52.4,NA,72,PDCI,72,150,54.8,NA,48.3,Independen,51.7,NA,NA,NA,Baoul√© (Bru),0,1,no,yes,no,yes,missing,missing,2,yes,2002,Camp militaire,Soualio,no,yes,"Baoul√©, Dioula","Militaires, guides",moins de cinquante,yes,don't know,none,no,n/a,n/a,n/a,yes,"Pillages, conflict over property, women",plus de cent,yes,FN,missing,yes,"mediation, public services","chefs traditionnels, commercants",no,n/a,yes,"chefs traditionnels, politiciens locaux, commercants, enseignants, leaders de la societe civile",FN,FN,FN,"FN, enseignants volontaires, ONG locale, acteurs internationaux",1,"personnels de sant√© professionels, acteurs internationaux",0,autre (volontaires),personne,yes,"directement des commercants, laisser-passer, barrages routiers, licences pour les taxis, impots au march√©",occasionellement,"taxation, mauvais comportment des elements FN",no,n/a,yes,barrages routiers,no,n/a,yes,barrages routiers,1,missing,missing,missing,missing,0,don't know,missing,missing,0,no,no,no,Guarde municipale (intervenes with problems of security),1,Fonctionnaire de maire,Catholique,Baoul√©,4eme niveau,Pas des difficult√©s,Partiellement sincere,Bonne connaissance,4,1,0,0,1,1,0,1,3,1,1,1,0,0,0,1,NA,10.17625901,61.85,3,0,10.17625901,1,Diabo,0,0,0,0.631578947,2.6875,0.300912575,NA,NA,NA,NA,NA,NA,NA
Touba,Foungbesso,18033,12,73.6,19.6,7.42,RDR,19.6,172,48.5,42.3,32.9,RDR,42.3,21561,31623,0.681814,Maou,0,1,no,no,no,yes,no,no,1,yes,2002,Barrage,don't know,no,yes,Maou,Militaires,moins de cinquante,yes,Nord,"dozos, forces impartiales",yes,FN-FDS,2002,don't know,yes,le comportement des FN,don't know,yes,FN,yes,yes,"mediation, public services","chefs traditionnels, leaders d'associations de jeunes",no,n/a,yes,autres fonctionnaires,"FN, autres personnes puissantes dans la communaut√©","FN, chefs traditionnels","FN, dozos","enseignants professionels, enseignants volontaires, acteurs internationaux",0,personnels de sant√© professionels,0,personne,personne,yes,"laisser-passer, barrages routiers, licences pour les taxis",occasionellement,mauvais comportements de certains √©l√©ments FN,no,n/a,no,n/a,no,n/a,no,n/a,0,no,n/a,no,n/a,0,no,n/a,no,0,no,no,no,no,0,president de la jeunesse,Islam,Maou,CEPE,pas de difficult√©,tres sincere,bonne connaissance,3,0,0,1,1,0,1,1,3,1,1,1,1,0,0,0,30.95,9.799958692,30.95,2,0,9.799958692,1,Foungbesso,0,0,0.138888889,NA,NA,0.885848131,NA,NA,NA,NA,NA,NA,NA
S√©gu√©la,SifiÈ,23667,205,68.9,80.7,18.4,RDR,80.7,185,62.3,34,50.2,PDCI,50.2,37406,44296,0.844455,koyaka,0,0,no,yes,no,yes,yes,no,3,yes,2002,Camp militaire,Djina; Kon√© mamourou; Diabi mamadou; Bamba,yes,yes,"Koyaka, burkinabe, maliens","Militaires, finances, activit√©s plitiques",plus de deux-cent,no,"Nord, CEDEAO","dozos, forces impartiales",yes,FN-FDS,2003,don't know,yes,"indiscipline, politique, argent",plus de cent,yes,"FN, personnes de la communait√©, criminels non identifi√©s",yes,yes,"mediation, public services","chefs traditionnels, religieux, politiciens locaux (RDR)",no,n/a,yes,"politiciens locaux, enseignants, personnel de sante, autres fonctionnaires",FN,"FN, chefs traditionnels","FN, forces impartiales","enseignants volontaires, acteurs internationaux, ONG locale",0,"personnels de sant√© volontaires, acteurs internationaux",0,personne,personne,yes,"directement des commercants, laisser-passer, barrages routiers, licences pour les, impots au march√©",occasionellement,mauvais comportements de certains √©l√©ments FN,no,n/a,no,n/a,no,n/a,no,n/a,0,yes,"Le general Bakayoko on l a vu seulement une fois depuis qu il est devenu chef d etat major, en occasion de la mort de son p√®re.",no,no,1,yes,Dons/offres √† la communaut√© (Losseni Fofana),no,1,no,no,no,no,0,agriculteur(chef du village),musulman,malink√©,pas d'enseignement formel achev√©,pas de difficult√©,partiellemnt sinc√®re,bonne connaissance,5,1,0,1,1,2,1,1,3,1,1,1,0,0,0,2,57.35,10.07183695,65.45,2,0,10.07183695,1,SifiÈ,1,0,0.083333333,0.6,4.6875,NA,0.6,0.733333333,0.433333333,0,0,0,1.533333333
Botro,Krofoinsou,11948,58,64.2,NA,11.2,UPCI,65.6,149,52.7,6.02,53.4,PDCI,53.4,NA,NA,NA,Tagbana (Baoul√©),0,0,no,no,no,no,no,no,0,no,2003,No permanent presence,none,don't know,no,n/a,n/a,n/a,yes,Burkina Faso,none,no,n/a,n/a,n/a,yes,Pillages,don't know,yes,FN,no,no,n/a,n/a,no,n/a,yes,missing,personne,chefs traditionnels,personne,"enseignants volontaires, autres personnes puissantes dans la communaute",0,personne,0,personne,personne,no,n/a,occasionellement,"mauvais comportement de FN, pillage de biens",no,n/a,no,n/a,no,n/a,no,n/a,0,no,n/a,no,n/a,0,no,n/a,no,0,no,no,no,don't know,0,Planteur,aucune religion,Baoul√©,pas d'enseignement formel acheve,Quelques difficultues,Tres sincere,Connaissance moyenne,2,0,0,0,0,0,0,0,3,1,1,1,0,0,0,0,NA,9.388319179,59.5,0,0,9.388319179,0,Krofoinsou,0,0,0,NA,NA,0.47535449,NA,NA,NA,NA,NA,NA,NA
Katiola,Katiola,56681,96,44.5,44.9,55.1,PDCI,55.1,162,50.1,49.5,47.9,RDR,49.5,28895,47970,0.602356,Senoufo,1,1,yes,yes,yes,yes,yes,yes,6,yes,2002,Camp militaire,"Siriki, Ouattara, Vetcho",yes,yes,"S√©noufo, Malink√©","Militaires, administrateurs, activit√©spolitiques",entre cent et deux-cent,no,"Nord, CEDEAO","dozos, forces impartiales",no,n/a,n/a,n/a,yes,"Accidents (balles perdues), rapes",moins de vingt,yes,dont' know,yes,yes,"mediation, public services, political support","chefs traditionnels, religieux, politiciens locaux (RDR), Commer√ßants et hommes/femmes d‚Äôaffaires, Enseignants (ceux qui n etaient pas de la localit√© sont partis), Leaders de la soci√©t√© civile (ONG), Leaders d‚Äôassociations de jeunes, Chasseurs/dozos Hunting / dozo groups",no,n/a,yes,"politiciens locaux (FPI), enseignants (seulement ceux qui √©tait d ailleurs)","FN, dozos",chefs traditionnels,FN,"enseignants professionels, enseignants volontaires, ONG locale, acteurs internationaux, FN",1,"personnels de sant√© professionels, personnels de sant√© volontaires",0,personne,"FN, autre personnes puissantes dans la communaut√©",yes,"directement des commer√ßants, laisser-passer, barrages routiers, licences pour les taxis, impots au march√©",occasionellement,mauvais comportement de certains membres de FN (stopped after 2004),yes,"maintenir l'ordre (La gendarmerie a sollicit√© Vetcho au d√©but, il a donn√© des armes aux gendarmes)",no,n/a,no,n/a,no,n/a,0,yes,C√©r√©monies publiques de nature religieuse ou nationale ,yes,"C√©r√©monies publiques de nature religieuse ou nationale (i.e. Ramadan, F√™te de l'Ind√©pendance, etc), Visite de nature priv√©e (i.e. membres de la famille, amis) ",1,yes,"Dons/offres √† la communaut√©, Dons/offres √† des particuliers",yes,1,no,yes,no,"Fonctionnaire, chef de la branche locale du RDR",1,Travailleur manuel qualifi√©,Catholique,Senoufo,CEPE,Pas des difficult√©s,Partiellement sinc√®re,Bonne connaissance,8,1,1,0,1,3,1,1,3,1,1,1,1,1,1,4,47.2,10.94519434,52.3,4,1,10.94519434,2,Katiola,1,1,0.189189189,0.5,1.222222222,0.509080725,0.45,0.45,0.65,0.05,0.05,0.1,1.7
S√©gu√©la,Bobi-Diarabana (Bobi),25249,202,67.9,53.6,23.1,RDR,53.6,184,41,38.5,14.9,Independen,43.7,37406,44296,0.844455,Malink√©,1,0,no,no,no,yes,no,no,1,yes,2002,Camp militaire,"Fofana, Samassi, Kon√© ",yes,yes,"
Malink√©, CEDEAO","Militaires, travailleurs dans les mines, acheteurs de diamants",entre cinquante et cent,yes,"Nord, CEDEAO","dozos, forces impartiales",no,n/a,n/a,n/a,yes,Conflits li√©s a l exploitation des diamants,moins de vingt,yes,FN,yes,yes,"mediation, public services","chef traditionnel, politicien local, commercants",no,n/a,yes,enseignants,"FN, dozos",chefs traditionnels,FN,"enseignants professionels, enseignants volontaires, FN",1,personnels de sant√© professionels,0,personne,autres personnes puissantes dans la communaut√©,yes,"directement des commer√ßants, laisser-passer, barrages routiers, impots au march√©, autre (taxes sur les diamants)",occasionellement,Questions de terre/propri√©t√© (Les FN empechaient aux autochtones d exploiter les diamants),yes,maintenir l'ordre,no,n/a,no,n/a,no,n/a,0,yes,Il r√©side ici ,yes,il r√©side ici ,1,no,n/a,no,0,no,no,no,no,0,Enseignant,Autre chr√©tien (enseignant),B√©t√©,BEPC,Pas des difficult√©s,Tr√®s sincere,Bonne connaissance,3,1,1,0,1,1,1,1,3,1,1,1,1,0,1,2,46.05,10.13654183,48.65,4,1,10.13654183,2,Bobi-Diarabana (Bobi),1,0,NA,NA,NA,NA,0.6,0.733333333,0.433333333,0,0,0,1.533333333
S√©gu√©la,Bobi-Diarabana (Diarabana),NA,NA,NA,NA,NA,,NA,NA,NA,NA,NA,,NA,NA,NA,NA,Malink√©,1,1,no,no,no,yes,no,no,1,yes,2002,Camp militaire,none,don't know,yes,"
Malink√©, CEDEAO",don't know,don't know,no,"Nord, CEDEAO","dozos, forces impartiales",no,n/a,n/a,n/a,yes,D√®sordre de la rebellion,don't know,no,n/a,yes,no,n/a,n/a,no,n/a,yes,"politiciens locaux, enseignants, personnel de sant√© (infirmier), autres fonctionnaires",FN,"FN, chefs traditionnels",FN,enseignants volontaires,0,personne,0,personne,personne,no,n/a,jamais,n/a,no,n/a,no,n/a,no,n/a,no,n/a,0,no,n/a,no,n/a,0,no,n/a,no,0,no,no,no,no,0,Minier,Islam,Malink√©,BEPC,Quelques difficult√©s,Partiellement sincere,Bonne connaissance,3,0,1,0,1,0,1,0,1,1,0,0,0,0,0,0,NA,NA,NA,2,1,10.13654183,1,Bobi-Diarabana (Diarabana),0,0,NA,NA,NA,NA,0.6,0.733333333,0.433333333,0,0,0,1.533333333
Touba,Touba,33188,13,50.3,61.7,NA,RDR,61.7,172,48.5,42.3,32.9,RDR,42.3,21561,31623,0.681814,Maou,0,1,yes,yes,yes,yes,yes,yes,6,no,2002,Camp militaire,"Soumahorou Abou, Djah Gao, Kon√© Gaoussou, Dramane (com zone)",no,yes,Maou,Militaires,moins de cinquante,yes,"Bouak√©, Nord","dozos, forces impartiales",yes,FN-FDS,2002,don't know,yes,le comportement des FN,plus de cent,yes,FN,yes,yes,"mediation, public services","chefs traditionnels, politiciens locaux, leaders de la societe civile",no,n/a,yes,"religieux, enseignants, personnel de sante, autres fonctionnaires","FN, dozos, forces impartiales",FN,"FN, dozos","FN, enseignants professionels, enseignants volontaires, ONG locale, acteurs internationaux",1,"FN, personnels de sante professionnel, acteurs internationaux",1,personne,personne,yes,"directedment des commercants, laisser-passer, barrages routiers, licences pour les taxis, imports au march√©",frequemment,"questions de terre/propriete, mauvais comportement de certains elements des Forces Nouvelles",no,n/a,no,n/a,no,n/a,no,n/a,0,"oui, occasionnellement (une ou deux fois par an)",ceremonies de nature privee,no,n/a,1,no,n/a,yes,0,yes,yes,yes,no,1,menuisier,Islam,missing,CEPE,pas de difficultes,tres sincere,bonne connaissance,8,1,0,1,1,2,1,1,4,1,1,1,1,0,0,2,52,10.40994364,52,4,0,10.40994364,1,Touba,0,1,0.208333333,0.28,3,1.255356866,NA,NA,NA,NA,NA,NA,NA
