Doropo,Doropo,37741,30,60.1,39.3,5.44,RDR,39.3,188,39.7,54.3,NA,RDR,54.3,NA,NA,NA,Koulongo,0,0,missing,missing,missing,missing,missing,missing,NA,no,2002,No permanent presence,"IB' (dead), Doum",no,yes,"Koulongo, Lobi, Malinke, Mossi, Malien, Peul",Militaires,entre cinquante et cent,no,Korhogo,none,no,n/a,n/a,n/a,yes,ne sait pas,entre vingt et cinquante,yes,FN,yes,yes,mediation,religieux,yes,chefs traditionnels,yes,"politiciens locaux, enseignants",FN,chefs traditionnels,FN,"enseignants volontaires, ONG locale",0,personnels de sant√© volontaires,0,autre (civil society),personne,yes,directement des commercants,occasionnellement,"taxation, mauvais comportement de FN",yes,maintenir l'ordre,no,n/a,no,n/a,no,n/a,0,yes (brother of Wattao?),visite de nature priv√©e,yes,visite de nature priv√©e,1,missing,missing,missing,NA,yes,yes,yes,no,1,,Catholique,Abron,Baccalaureat,pas de difficultes,tres sincere,bonne connaissance,NA,1,0,0,1,NA,1,1,2,1,1,0,0,0,1,NA,46.8,10.53850232,46.8,2,0,10.53850232,1,Doropo,0,0,0.14,0.25,1.3,0.857853658,NA,NA,NA,NA,NA,NA,NA
Korhogo,Korhogo (Air France),NA,171,44.5,84.7,15.2,RDR,84.7,134,30.2,79.9,20.1,RDR,79.9,126646,161186,0.785713,Senoufo,0,1,yes,yes,yes,yes,yes,yes,6,yes,2002,Camp militaire,"Fofie (""commandant de zone"")",no,yes,"Senoufo, Dioula",Militaires,plus de deux-cent,no,"Abidjan, Bouake, Korhogo",dozos,yes,FN-FN,2004,plus de cent,yes,ne sait pas,plus de cent,missing,missing,yes,yes,missing,chefs traditionnels,no,n/a,yes,"chefs traditionnels, religieux, politiciens locaux, commercants, enseignants, leaders de la societe civile, dozos, autre","FN, dozos, forces impartiales","FN, chefs traditionnels, politiciens locaux",FN,"FN, chefs traditionnels, politiciens locaux, ONG locale",1,"FN, chefs traditionnels, politiciens locaux, ONG locale",1,FN,ONG locale,no,n/a,jamais,n/a,no,n/a,no,n/a,no,n/a,no,n/a,0,yes,missing,yes,missing,1,yes,argent de poche au demobilises,yes,1,yes,yes,yes,"leader communautaire, fonctionnaire, parti politique, dirigiant ONG, homme d'affaire",1,enseignant,aucune,,secondaire acheve,quelques difficultes,partiellement sincere,,8,1,1,1,1,3,1,1,1,1,0,0,0,0,0,3,82.3,NA,82.3,5,0,12.56399531,2,Korhogo,0,1,NA,NA,NA,NA,0.1375,0.425,0.1625,0.3625,0.1,0.1625,2.6375
Korhogo,Korhogo (Klofowakaha),NA,NA,NA,NA,NA,,NA,NA,NA,NA,NA,,NA,NA,NA,NA,Malink√©,0,1,yes,yes,yes,yes,yes,yes,6,yes,2002,No permanent presence,"Fofie (""commandant de zone"")",no,no,n/a,n/a,n/a,yes,don't know,aucun,no,n/a,n/a,n/a,no,n/a,n/a,no,n/a,no,yes,mediation,chefs traditionnels,no,n/a,no,n/a,"FN, chefs traditionnels",chefs traditionnels,FN,"enseignants professionnels, acteurs internationaux",0,"personnel de sante professionel, acteurs internationaux",0,personne,personne,yes,barrages routiers,occasionellement,mauvais comportement de certains elements des FN,yes,maintenir l'ordre,no,n/a,no,n/a,no,n/a,0,no,n/a,no,n/a,0,no,n/a,no,0,no,no,no,no,0,chef de quartier,Islam,Malinke,pas d'enseignement formel acheve,quelques difficultes,tres sincere,mauvaise connaissance,8,0,1,0,0,0,0,1,1,0,0,1,0,0,1,1,NA,NA,NA,2,0,12.56399531,0,Korhogo,0,1,NA,NA,NA,NA,0.1375,0.425,0.1625,0.3625,0.1,0.1625,2.6375
Gb√©l√©ban,GbÈlÈban,2569,122,76.7,79.1,NA,RDR,79.1,42,89,100,NA,RDR,100,NA,NA,NA,Malink√©,0,0,yes,no,no,yes,yes,no,3,yes,2002,Camp militaire,Chef de poste,yes,yes,,Militaires,moins de cinquante,yes,Nord,"dozos, forces impartiales",no,n/a,n/a,n/a,no,n/a,n/a,yes,FN,yes,yes,"mediation, public services","chefs traditionnels, religieux, leaders d'associations de jeunes",no,n/a,yes,"enseignants, personnel de sante, autres fonctionnaires",FN,chefs traditionnels,FN,"enseignants volontaires, acteurs internationaux",0,"personnels de sante benevole, autres personnes puissantes dans la communaute, acteurs internationaux",0,autres personnes puissantes dans la communaute,personne,yes,"barrages routiers, autre (extortion for protection)",occasionellement,mauvais comportement des FN,no,n/a,yes,barrages routiers,no,n/a,no,n/a,1,no,n/a,no,n/a,0,no,n/a,no,0,no,no,no,no,0,"chef de terre, doyenne",Islam,Malinke,CEPE,pas de difficultes,tres sincere,bonne connaissance,5,1,1,0,1,0,1,1,2,0,1,1,1,0,0,0,89.55,7.851271997,89.55,2,0,7.851271997,1,GbÈlÈban,1,0,NA,NA,NA,NA,NA,NA,NA,NA,NA,NA,NA
Korhogo,Niofoin,26471,165,70.9,23.1,24.8,Independent,45.4,135,51.7,100,NA,RDR,100,126646,161186,0.785713,Senoufo,0,0,no,yes,yes,yes,yes,no,4,yes,2002,Camp militaire,"Konat√©, Abov (""commandant de secteur"")",no,yes,Senoufo,Militaire,don't know,yes,Nord,dozos,no,n/a,n/a,n/a,yes,le comportement des FN,don't know,yes,FN,no,no,n/a,n/a,no,n/a,yes,"enseignants, personnel de sante, autres fonctionnaires","FN, dozos",FN,FN,enseignants volontaires,0,acteurs internationaux,0,personne,personne,yes,"laisser-passer, barrages routiers",occasionellement,don't know,no,n/a,no,n/a,no,n/a,no,n/a,0,no,n/a,no,n/a,0,no,n/a,no,0,no,no,no,fonctionnaire ,1,agent de mairie,aucune,Senoufo,BEPC,pas de difficultes,partiellement sincere,bonne connaissance,6,1,1,0,1,1,0,0,3,1,1,1,0,0,0,1,61.55,10.18380507,72.7,2,0,10.18380507,0,Niofoin,0,0,1,0.705882353,1.642857143,1.84050282,0.1375,0.425,0.1625,0.3625,0.1,0.1625,2.6375
Sin√©matiali,SinÈmatiali,37795,172,63,54.8,5.46,RDR,54.8,140,51.8,68.5,NA,RDR,68.5,NA,NA,NA,Senoufo,0,1,yes,yes,yes,yes,yes,yes,6,no,2002,Camp militaire,"Aruna Coulibaly, Kone Adama (Comsecteur)",no,yes,"Senoufo, CEDEAO, melange","Militaires, dozos auxiliares",plus de deux-cent,yes,"Nord, autre (Seguela)","dozos, forces impartiales",yes,FN-population,2008,monis de vingt,yes,affrontements femmes et FN,don't know,yes,FN,no,no,n/a,n/a,yes,"chefs traditionnels, leaders de la societe civile (jeunes)",yes,"enseignants, personnel de sante, autres fonctionnaires",personne,"chefs traditionnels, autres personnes puissantes dans la commmunaute","FN, dozos, forces impartiales","enseignants professionnels, enseignants volontaires, autre (population eux-memes)",0,"personnels de sante professionnel, autre (population eux-meme)",0,personne,personne,yes,"directement des commercants, laisser-passer, barrages routiers, licences pour les taxis, impots au marche",frequemment,"taxation, mauvais comportement de certains elements des FN, conflits d'autorite entre leaders FN et d'autres personnes importantes dans la communaute",no,n/a,no,n/a,no,n/a,no,n/a,0,no,n/a,no,n/a,0,no,n/a,no,0,no,no,no,no,0,"chef de village + notables, responsable de jeunesse","autre chretien, Islam",Senoufo,focus group,pas de difficultes,tres sincere,bonne connaissance,8,0,1,1,1,0,0,0,4,1,1,1,0,0,0,0,61.65,10.5399321,61.65,1,0,10.5399321,-1,SinÈmatiali,0,0,0.962962963,0.5,1.64516129,NA,0.1,0,0,0.2,0,0.1,2.3
Korhogo,Lataha,30745,170,51.7,60.6,11.5,RDR,60.6,134,30.2,79.8,20.1,RDR,79.8,126646,161186,0.785713,Senoufo,0,0,no,no,no,yes,yes,no,2,yes,2002,Barrage,don't know,don't know,no,n/a,n/a,n/a,missing,missing,dozos,no,n/a,n/a,n/a,yes,le comportement des FN,don't know,no,n/a,no,n/a,n/a,n/a,yes,"chefs traditionnels, leaders de la societe civile (jeunes)",no,n/a,dozos,chefs traditionnels,dozos,enseignants volontaires,0,acteurs internationaux,0,personne,personne,no,n/a,occasionellement,mauvais comportement des FN,no,n/a,no,n/a,no,n/a,no,n/a,0,no,n/a,no,n/a,0,no,n/a,no,0,no,no,no,no,0,president de jeunes,Islam,Senoufo,CEPE,pas de difficultes,tres sincere,bonne connaissance,4,0,1,0,0,0,0,0,2,1,0,1,0,0,0,0,70.2,10.33348266,70.2,0,0,10.33348266,0,Lataha,0,0,0.958333333,NA,NA,1.64352781,0.1375,0.425,0.1625,0.3625,0.1,0.1625,2.6375
Madinani,N'Goloblasso,8721,120,64.3,31.7,6.9,Independent,32.8,43,62.3,59.6,NA,RDR,59.6,11144,12912,0.863073,Malink√©,0,0,no,no,no,yes,no,no,1,yes,2002,Camp militaire,Chef de poste,no,yes,Malink√©,Militaires,don't know,no,Nord,"dozos, forces impartiales",no,n/a,n/a,n/a,no,n/a,n/a,no,n/a,yes,yes,mediation,president de jeunes,no,n/a,yes,"enseignants, personnel de sante","dozos, forces impartiales",chefs traditionnels,personne,enseignants volontaires,0,personnels de sante benevole,0,"chefs traditionnels, autre (population eux-meme)",personne,yes,barrages routiers,occasionellement,mauvaise comportement de certains elements des FN,no,n/a,no,n/a,no,n/a,no,n/a,0,yes,visite de nature privee,yes,visite de nature privee,1,don't know,n/a,no,0,no,no,no,no,0,"cultivateur, chef de village",Islam,Malink√©,pas d'enseignement formel acheve,quelques difficultes,partiellement sincere,connaissance moyenne,3,1,1,0,1,1,1,1,1,0,0,1,0,0,0,1,45.65,9.073489189,46.2,0,0,9.073489189,1,N'Goloblasso,0,0,0.916666667,NA,NA,2.595576496,0.1,0.1,0.1,0.6,0.2,0.5,2.9
Korhogo,Koni,11948,170,51.7,60.6,11.5,RDR,60.6,134,30.2,79.8,20.1,RDR,79.8,126646,161186,0.785713,Senoufo,0,0,no,no,no,yes,no,no,1,yes,2002,Barrage,"Madov (""chef de poste"")",no,yes,Senoufo,Militaires,moins de cinquante,yes,Nord,dozos,no,n/a,n/a,n/a,no,n/a,n/a,no,n/a,no,yes,public services,chefs traditionnels,no,n/a,yes,"enseignants, personnel de sante","FN, chefs traditionnels, dozos",chefs traditionnels,FN,enseignants volontaires,0,"personnels de sant√© volontaires, autre (communaute catholique)",0,personne,personne,no,n/a,jamais,n/a,no,n/a,no,n/a,no,n/a,no,n/a,0,no,n/a,no,n/a,0,no,n/a,no,0,no,no,no,no,0,agriculteur,Islam,Senoufo,CEPE,pas de difficultes,partiellement sincere,connaissance moyenne,3,0,1,0,1,0,0,1,0,0,0,0,0,0,0,0,70.2,9.388319179,70.2,2,0,9.388319179,0,Koni,0,0,0.25,NA,NA,1.838234562,0.1375,0.425,0.1625,0.3625,0.1,0.1625,2.6375
Madinani,Madinani,25054,120,64.3,31.7,6.9,Indepenent,32.8,43,62.3,59.6,NA,RDR,59.6,11144,12912,0.863073,Senoufo,0,0,yes,yes,yes,yes,yes,no,5,yes,2002,Camp militaire,Coul - Dao Djan (commandant de secteur),no,yes,"Malink√©, Senoufo",Militaires,entre cinquante et cent,no,Nord,"dozos, forces impartiales",no,n/a,n/a,n/a,yes,le comportement des elements,plus de cent,yes,FN,no,yes,"mediation, public services","chefs traditionnels, enseignants, personnel de sante, autres fonctionnaires",no,n/a,yes,"enseignants, autres fonctionnaires","FN, dozos","FN, chefs traditionnels","FN, dozos","enseignants volontaires, enseignants professionnels",0,"personnels de sante professionnel, acteurs internationaux",0,personne,personne,yes,"directement des commercants, laisser-passer, barrages routiers, licences pour les taxis, impots au marche",occasionellement,mauvais comportement de certains elements des Forces Nouvelles,no,n/a,yes,"directement des commercants, laisser-passer, barrages routiers, licences pour les taxis, impots au marche",no,n/a,no,n/a,1,no,n/a,no,n/a,0,no,no,no,0,no,yes,no,no,1,president de jeunes,Islam,missing,BEPC,pas de difficultes,tres sincere,bonne connaissance,7,1,1,0,1,1,0,1,3,1,1,1,1,0,0,1,45.65,10.12878877,46.2,2,0,10.12878877,0,Madinani,0,0,0.675,1,0.545454545,2.189417781,0.1,0.1,0.1,0.6,0.2,0.5,2.9
Kouto,Kolia,24848,17,67.2,41.3,26.3,RDR,41.3,126,65.4,66.7,NA,RDR,66.7,NA,NA,NA,Senoufo,0,1,no,yes,no,yes,yes,no,3,yes,2002,Camp militaire,don't know,no,yes,"Senoufo, Malink√©","Militaires, civiles",moins de cinquante,yes,Nord,"dozos, forces impartiales",no,n/a,n/a,n/a,no,n/a,n/a,no,n/a,yes,yes,mediation,"chefs traditionnels, leaders de la societe civile (ONG)",no,n/a,yes,"enseignants, personnel de sante, autres fonctionnaires","FN, dozos, forces impartiales",chefs traditionnels,dozos,"enseignants professionnels, enseignants volontaires, autres personnes puissantes dans la communaute",0,"personnels de sante professionnel, acteurs internationaux",0,personne,personne,yes,"laisser-passer, barrages routiers",jamais,n/a,no,n/a,no,n/a,no,n/a,no,n/a,0,no,n/a,no,n/a,0,no,no,no,0,no,yes,no,no,1,conseille du chef de canton,Islam,Malink√©,BEPC,pas de difficultes,partiellement sincere,bonne connaissance,5,1,1,0,1,1,1,1,0,0,0,0,0,0,0,1,54,10.12053255,54,1,0,10.12053255,1,Kolia,0,0,0.9,NA,NA,2.173544934,0.1,0.2,0.2,0.1,0,0,3.2
Ferkess√©dougou,FerkessÈdougou,120150,186,82,99.1,NA,RDR,99.1,141,41.2,33.6,NA,Independen,50.8,71082,81294,0.874382,Senoufo,0,1,yes,yes,yes,yes,yes,yes,6,yes,2002,Camp militaire,"Commandant de zone, from Odienne, then a Baoule, then a Lobi",no,yes,"Senoufo, Dyula, Moissi, Foreigners",Militaires,don't know,yes,Nord,"dozos, forces impartiales",no,n/a,n/a,n/a,yes,"take children, malcomportement",don't know,yes,FN,yes,yes,"mediation, autre (taxes were too high, we did not accept this)","chefs traditionnels, religieux, politiciens locaux",yes,chefs traditionnels,yes,enseignants,"FN, chefs traditionnels, dozos, forces impartiales",chefs traditionnels,"FN, dozos, forces impartiales","FN, chefs traditionnels, enseignants professionnels, enseignants volontaires, ONG locale, acteurs internationaux",1,"FN, chefs traditionnels, personnels de sante professionel, acteurs internationaux",1,"FN, chefs traditionnels",FN (Credit du Nord),yes,"directement des commercants, laisser-passer, barrages routiers, licences pour les taxis, impots au marche",occasionellement,"taxation, mauvais comportement de certains elements de FN",yes,maintenir l'ordre,yes,barrages routiers,yes,maintenir l'ordre,no,n/a,1,"oui, il reside/a reside ici","visite de nature militaire, visite chez des membres des elites communautaires, visite de nature privee",no,n/a,1,don't know,n/a,no,0,yes,no,no,no,1,representatif de chef de canton,Islam,Senoufo,pas d'enseignement formel acheve,quelques difficultes,tres sincere,bonne connaissance,8,1,1,0,1,2,1,1,3,1,1,1,0,0,1,3,66.35,11.69649624,74.95,6,0,11.69649624,2,FerkessÈdougou,0,0,0.870588235,0.5375,1.885714286,NA,0.3,0.35,0.15,0.15,0.1,0.2,2.2
Korhogo,Sohouo,16029,NA,NA,NA,NA,,NA,NA,NA,NA,NA,,NA,126646,161186,0.785713,Senoufo,0,0,no,no,no,yes,yes,no,2,yes,2002,Barrage,don't know,no,yes,Senoufo,Militaires,moins de cinquante,yes,Nord,"dozos, forces impartiales",yes,don't know,don't know,don't know,yes,opposition au FN,moins de vingt,no,n/a,no,no,n/a,n/a,yes,chefs traditionnels,yes,"enseignants, personnel de sante","FN, dozos",chefs traditionnels,dozos,enseignants volontaires,0,personnels de sant√© professionnels,0,personne,personne,yes,"laisser-passer, barrages routiers",occasionellement,"mauvais comportement de FN, conflits d'autorit√© entre leaders des Forces Nouvelles, divergences d'opinions politiques",no,n/a,no,n/a,no,n/a,no,n/a,0,no,n/a,no,n/a,0,no,n/a,no,0,no,no,no,no,0,agriculteur,missing,missing,missing,pas de difficultes,partiellement sincere,bonne connaissance,4,0,1,1,1,0,0,0,2,1,0,1,0,0,0,0,NA,9.682154861,NA,1,0,9.682154861,0,Sohouo,0,0,1,NA,NA,1.71707864,0.1375,0.425,0.1625,0.3625,0.1,0.1625,2.6375
Ferkess√©dougou,TogoniÈrÈ,13025,187,53.4,92.5,7.5,RDR,92.5,142,80.3,19.4,NA,Independen,45.3,71082,81294,0.874382,Senoufo,0,0,no,no,no,yes,no,no,1,no,2002,No permanent presence,Chef de poste (at Koumbala),no,yes,don't know,don't know,moins de cinquante,yes,Nord,"dozos, forces impartiales",no,n/a,n/a,n/a,no,n/a,n/a,yes,FN,yes,yes,missing,chefs traditionnels,yes,chefs traditionnels,yes,"religieux, enseignants, personnel de sante",dozos,chefs traditionnels,dozos,"enseignants volontaires, autre (PNRC)",0,personnels de sante benevole,0,autre (CIDT),personne,yes,"directement des commercants, laisser-passer, barrages routiers, impots au marche","non, jamais",n/a,no,n/a,no,n/a,no,n/a,no,n/a,0,no,n/a,no,n/a,0,no,n/a,no,0,no,no,no,no,0,agriculteur,Islam,missing,pas d'enseignement formel acheve,quelques difficultes,partiellement sincere,connaissance moyenne,3,0,1,0,1,0,1,1,1,0,1,0,0,0,0,0,55.95,9.474625867,68.9,0,0,9.474625867,1,TogoniÈrÈ,0,0,1,NA,NA,NA,0.3,0.35,0.15,0.15,0.1,0.2,2.2
Gb√©l√©ban,Sedougou,4397,122,76.7,79.1,NA,RDR,79.1,42,89,100,NA,RDR,100,NA,NA,NA,Malink√©,0,0,no,yes,no,yes,no,no,2,yes,2002,Camp militaire,"Ahmed, Diarassouba, Sangare, Fany (chef de postes)",no,no,n/a,n/a,n/a,yes,Nord,"dozos, forces impartiales",no,n/a,n/a,n/a,no,n/a,n/a,yes,FN,yes,yes,mediation,chefs traditionnels,no,n/a,yes,"enseignants, fonctionnaires","FN, dozos","FN, chefs traditionnels",dozos,"enseignants volontaires, autre (PNRC)",0,"personnels de sante professionnel, acteurs internationaux",0,personne,personne,yes,"directement des commercants, laisser-passer, barrages routiers, licences pour les taxis, impots au marche",occasionellement,mauvais comportement de certains elements des Forces Nouvelles,no,n/a,no,n/a,no,n/a,no,n/a,0,no,n/a,no,n/a,0,no,n/a,no,0,no,no,no,no,0,"agent de mairie, chef du village",Islam,Malinke,BEPC,pas de difficultes,partiellement sincere,connaissance moyenne,4,0,1,0,0,0,1,1,2,0,1,1,0,0,0,0,89.55,8.388677769,89.55,1,0,8.388677769,1,Sedougou,0,0,NA,0.6,1.111111111,2.37850722,NA,NA,NA,NA,NA,NA,NA
Sin√©matiali,Kagbolodougou,9356,172,63,54.8,5.46,RDR,54.8,140,51.8,68.5,NA,RDR,68.5,NA,NA,NA,Senoufo,0,0,no,no,no,yes,no,no,1,yes,2002,Barrage,Commandant Oumar (comsecteur),no,yes,Senoufo,Militaires,moins de cinquante,yes,don't know,forces impartiales,no,n/a,n/a,n/a,yes,accusations injustes ouvers les personnes; ils cherchent les femmes des gens,moins de vingt,yes,FN,yes,yes,mediation,chefs traditionnels,no,n/a,yes,"enseignants, personnel de sante, autres fonctionnaires","FN, chefs traditionnels, forces impartiales",chefs traditionnels,FN,"chefs traditionnels, enseignants volontaires",0,personnels de sante benevole,0,autre (COIC),personne,yes,"laisser-passer, barrages routiers, licences pour les taxis, autre (cotisations obligatoires imposees aux populations)",occasionellement,mauvais comportement de certains elements des Forces Nouvelles,yes,maintenir l'ordre,yes,"laisser-passer, barrages routiers, licences pour les taxis",no,n/a,no,n/a,1,"oui, il reside/a reside ici",ceremonies de nature privee,no,n/a,1,no,n/a,no,0,no,no,no,no,0,chef du canton,Islam,Senoufo,BEPC,pas de difficultes,tres sincere,connaissance moyenne,3,1,1,0,1,1,1,1,3,1,1,1,0,0,1,2,61.65,9.143773128,61.65,2,0,9.143773128,1,Kagbolodougou,0,0,NA,NA,NA,1.397800831,0.1,0,0,0.2,0,0.1,2.3
Odienn√©,TiÈmÈ,9182,124,69.7,43.6,4.82,RDR,43.6,47,71.9,48.6,NA,RDR,48.6,43565,48431,0.899527,Malink√©,0,0,no,yes,yes,yes,yes,no,4,yes,2002,Barrage,Djah Gao,no,yes,"Malink√©,  Senoufo",Militaires,don't know,yes,Nord,"dozo, forces impartiales",yes,FN-FDS,2002,moins de vingt,yes,le comportement des FN,don't know,yes,FN,yes,yes,"autre (negotiated the arrival of the FN, sought approval from local leaders beforehand)",chefs traditionnels,no,n/a,yes,"enseignants, personnel de sante, autres fonctionnaires","FN, dozos","FN, chefs traditionnels","FN, dozos","FN, enseignants professionnels, enseignants volontaires, acteurs internationaux",1,"personnels de sante professionel, acteurs internationaux",0,personne,personne,yes,"directement des commercants, laisser-passer, barrages routiers, licences pour les taxis, impots au marche",occasionellement,mauvais comportement de certains elements des Forces Nouvelles,no,n/a,no,n/a,no,n/a,no,n/a,0,no,n/a,no,n/a,0,no,n/a,no,0,no,no,no,no,0,agent de la mairie,catholique,Adioukrou,Baccalaureat,pas de difficultes,tres sincere,connaissance moyenne,6,0,1,1,1,0,1,1,3,1,1,1,0,0,0,0,46.1,9.125000325,46.1,3,0,9.125000325,2,TiÈmÈ,0,0,0.333333333,NA,NA,NA,0.2,0.5,0.1,0.5,0,0.3,2.7
Sin√©matiali,Boukaha,5704,172,63,54.8,5.46,RDR,54.8,140,51.8,68.5,NA,RDR,68.5,NA,NA,NA,Senoufo,0,0,no,no,no,yes,no,no,1,no,2002,No permanent presence,Commandant Kone (chef de poste),no,yes,Senoufo,Militaire,moins de cinquante,yes,Nord,aucun,no,n/a,n/a,n/a,no,n/a,n/a,yes,criminels non identifies,yes,yes,missing,missing,no,n/a,yes,enseignants,"FN, forces impartiales",chefs traditionnels,forces impartiales,"chefs traditionnels, enseignants volontaires, acteurs internationaux, autre (parents d'ecole)",0,"chefs traditionnels, personnels de sante professionel, acteurs internationaux",0,"chefs traditionnels, autre (jeunesse du village)",personne,yes,barrages routiers,"non, jamais",n/a,yes,maintenir l'ordre,no,n/a,no,n/a,no,n/a,0,no,n/a,no,n/a,0,no,n/a,no,0,no,no,no,no,0,chef du village,autre (animiste),Senoufo,Pas d'enseignement primaire achev√©,pas de difficult√© achev√©e,tres sinc√®re,bonne connaissance,3,0,1,0,1,0,1,1,1,0,1,0,0,0,1,1,61.65,8.648922962,61.65,1,0,8.648922962,1,Boukaha,0,0,1,NA,NA,1.530742704,0.1,0,0,0.2,0,0.1,2.3
Katiola,TimbÈ,11307,96,44.5,44.9,55.1,PDCI,55.1,162,50.1,49.5,47.9,RDR,49.5,28895,47970,0.602356,Senoufo,1,1,no,no,no,yes,no,no,1,no,2002,Barrage,don't know,no,no,n/a,n/a,n/a,yes,"Surrounding s/p (i.e. Katiola), CEDEAO",forces impartiales,no,n/a,n/a,n/a,yes,"Viols, pillages",entre cinquante et cent,yes,FN,no,yes,mediation ,chefs traditionnels,no,n/a,yes,enseignants,FN,FN,FN,enseignants volontaires,0,"personnels de sant√© volontaires, acteurs internationaux",0,personne,autre personnes puissante dans la communaut√©,yes,"barrages routiers, impots au march√©",occasionellement,mauvais comportement,yes,maintenir l'ordre,no,n/a,no,n/a,no,n/a,0,Yes (Vetcho),C√©r√©monies publiques de nature religieuse ou nationale ,yes,C√©r√©monies publiques de nature religieuse ou nationale ,1,yes,Dons/offres √† la communaut√©,missing,1,no,no,no,no,0,Travailleur manuel qualifi√©,Catholique,Senoufo,Pas d'enseignement primaire achev√©,Quelques difficult√©s,Tr√®s sincere,Connaissance moyenne,3,1,1,0,0,2,0,1,3,1,1,1,0,0,1,3,47.2,9.333177282,52.3,2,1,9.333177282,0,TimbÈ,0,0,0,NA,NA,NA,0.45,0.45,0.65,0.05,0.05,0.1,1.7
B√©oumi,Marabadiassa,6640,57,59.4,14.7,52.9,PDCI,52.9,148,67.2,NA,33.8,Independen,66.2,4006,30874,0.129753,Dendi (zerman du Niger),0,1,no,yes,yes,yes,yes,no,4,yes,2002,Camp militaire,Traore djakaridja (djackson),no,yes,"Bouake, burkina faso, mali",don't know,don't know,yes,"burkina faso, mali","dozo, forces impartiales",no,n/a,n/a,n/a,yes,"opposition a la rebellion, pilage, vol",entre cinquante et cent,yes,FN,yes,yes,mediation ,chefs traditionnels,yes,chefs traditionnels,yes,"enseignants, politiciens locaux personnels de sant√© et autres fonctionnaires",FN,"FN, chefs traditionnels",FN,"chefs traditionnels, enseignants professionnels, enseignants volontaires, ONG locale, acteurs internationaux",0,"personnels de sant√© volontaires, acteurs internationaux",0,personne,"chefs traditionnels, autres personnes puissante de la communaut√©",yes,"directement des commercants, laisser-passer, barrages routiers, impots au march√©",frequemment,"question de terre/propri√©t√©, mauvais comportement de certains elements de la FN, conflit d'autorit√© entre les leaders des FN ou et entre les leaders des FN et d'autres personnes importantes dans la communaut√©",yes,"maintenir l'ordre, reprimer la criminalit√©",no,n/a,no,n/a,no,n/a,0,Yes((rarely),Visite de nature priv√©e,no,n/a,1,no,n/a,no,0,missing,no,no,no,0,professeur(enseignant),musulman,dandawa(zerman),universit√© achev√©e,pas de difficult√© achev√©e,tres sinc√®re,bonne connaissance,6,1,0,0,1,1,1,1,4,1,1,1,0,0,1,2,NA,8.800867242,59.55,2,0,8.800867242,0,Marabadiassa,0,0,0.333333333,NA,NA,0.468999707,0.733333333,0.533333333,0.6,0.133333333,0,0.033333333,1.4
S√©gu√©la,Dualla,8130,204,71.2,54.1,10.1,RDR,54.1,182,73.1,42.8,NA,RDR,42.8,37406,44296,0.844455,Malink√©,1,0,no,yes,no,yes,yes,no,3,yes,2002,Barrage,"Kon√©, Samassi, Fofanna, Tuo (""chef de poste"")",yes,yes,"Malink√© (Koyaka), 'melang√©'",Militaires,moins de cinquante,yes,"Nord, CEDEAO","dozos, forces impartiales",no,n/a,n/a,n/a,yes,"Justice sommaire, mauvaise comportement de FN",plus de cent,yes,FN,yes,yes,"mediation, public services","chefs traditionnels, politiciens locaux, autres fonctionnaires (mairie), leaders de la societe civile, leaders d'associations de jeunes, dozos (chef de dozos)",no,n/a,yes,"enseignants, autres fonctionnaires, politiciens locaux, commercants, personnel de sante, leaders de la societe civile","FN, dozos, forces impartiales",FN,"FN, dozos","enseignants professionnels, enseignants volontaires, acteurs internationaux, ONG locale",0,"personnels de sant√© professionels, personnels de sant√© volontaires, acteurs internationaux",0,autre (Community members),personne,yes,"directement des commercants, barrages routiers, autre (enrigistre des enfants a la mairie)",occasionellement,mauvais comportement de FN,yes,"maintenir l'ordre, proteger des attaques d'autres groupes armes",no,n/a,no,n/a,no,n/a,0,no,N/A,no,n/a,0,missing,Potential dons au demobilise (CHECK),no,0,yes,no,no,no,1,"Fontionnaire de mairie, Chef traditionnel",Islam,Senoufo,Formation professionelle apr√®s le BEPC,Pas de difficultes ,Partiellement sincere,Bonne connaissance,5,1,1,0,1,1,1,1,3,1,1,1,0,0,1,2,48.45,9.003316203,48.45,2,1,9.003316203,1,Dualla,1,0,0.083333333,NA,NA,0.879994381,0.6,0.733333333,0.433333333,0,0,0,1.533333333
B√©oumi,Ando-KÈkrÈnou,12526,56,49.2,17.8,25.5,Independent,56.9,147,48.1,NA,19.7,Independen,32.8,NA,NA,NA,Baoul√©,0,0,no,no,no,yes,no,no,1,yes,2002,No permanent presence,don't know,don't know,no,n/a,n/a,n/a,yes,don't know,none,no,n/a,n/a,n/a,yes,"On a accus√© quelques d avoir tu√© quelques un d autre, puis il y a eu une personne tue par balle perdue",moins de vingt,missing,missing,no,no,n/a,n/a,no,n/a,yes,"enseignants, jeunes",FN,"FN, chefs traditionnels",FN,enseignants volontaires,0,"personnels de sant√© professionels, ONG locale, acteurs internationaux",0,personne,personne,no,n/a,jamais,n/a,no,n/a,no,n/a,no,n/a,no,n/a,0,missing,missing,missing,missing,0,no,n/a,missing,0,no,no,no,n/a,0,Agriculteur,Other Christian,Baoul√©,Primaire,Beaucoup de difficult√©s,Tr√®s sincere,,3,0,0,0,0,0,0,0,1,1,0,0,0,0,0,0,NA,9.435561763,44.85,2,0,9.435561763,0,Ando-KÈkrÈnou,0,0,0,0.368421053,6.157894737,NA,0.733333333,0.533333333,0.6,0.133333333,0,0.033333333,1.4
